{
  "score_id": "score_bci_2026_07_05",
  "topic_id": "bci",
  "score_date": "2026-07-05",
  "stage_snapshot": {
    "current_stage": "S4",
    "max_allowed_stage": "S4",
    "why_not_higher_stage": "Missing pricing adoption; Missing hard reality evidence.",
    "evidence_ids": [
      "bci_parent_label",
      "bci_parent_capital"
    ],
    "data_confidence_cap_applied": false
  },
  "dimensions": {
    "policy_perception": {
      "score": 20,
      "evidence_ids": [
        "bci_parent_label",
        "bci_parent_capital"
      ],
      "reasoning": "Policy perception uses policy naming and support evidence only when present.",
      "missing_data": [
        "policy naming and support evidence"
      ],
      "confidence": 70
    },
    "market_perception": {
      "score": 65,
      "evidence_ids": [
        "bci_parent_label"
      ],
      "reasoning": "Score is derived only from structured evidence that affects perception.",
      "missing_data": [],
      "confidence": 70
    },
    "trading_perception": {
      "score": 60,
      "evidence_ids": [
        "bci_parent_label"
      ],
      "reasoning": "Trading perception requires stable label or mapped beneficiary evidence.",
      "missing_data": [],
      "confidence": 70
    },
    "capital_confirmation": {
      "score": 65,
      "evidence_ids": [
        "bci_parent_capital"
      ],
      "reasoning": "Capital score uses leader, breadth, volume, or financing evidence when present.",
      "missing_data": [],
      "confidence": 70
    },
    "pricing_adoption": {
      "score": 25,
      "evidence_ids": [
        "bci_parent_label",
        "bci_parent_capital"
      ],
      "reasoning": "Pricing score requires valuation reframing or financial translation evidence.",
      "missing_data": [
        "valuation reframing evidence"
      ],
      "confidence": 70
    },
    "parent_reality": {
      "score": 20,
      "evidence_ids": [
        "bci_parent_label",
        "bci_parent_capital"
      ],
      "reasoning": "Parent reality only uses evidence mapped to the parent narrative.",
      "missing_data": [
        "parent-level orders, revenue, customers, regulatory, clinical, product, or profit evidence"
      ],
      "confidence": 70
    },
    "branch_reality": {
      "score": 70,
      "evidence_ids": [
        "bci_e001"
      ],
      "reasoning": "Branch reality only uses evidence explicitly mapped to a branch.",
      "missing_data": [],
      "confidence": 75
    },
    "branch_coverage": {
      "score": 45,
      "evidence_ids": [
        "bci_branch_label_pricing",
        "bci_e001"
      ],
      "reasoning": "Branch coverage reflects how representative branch evidence is for the parent narrative.",
      "missing_data": [],
      "confidence": 75
    },
    "feedback": {
      "score": 25,
      "evidence_ids": [
        "bci_parent_label",
        "bci_parent_capital"
      ],
      "reasoning": "Feedback score uses perception-capital-reality loop evidence.",
      "missing_data": [
        "closed-loop feedback evidence"
      ],
      "confidence": 70
    },
    "execution_friction": {
      "score": 35,
      "evidence_ids": [
        "bci_parent_label",
        "bci_parent_capital"
      ],
      "reasoning": "Execution friction uses negative execution, regulation, clinical, delivery, or commercialization evidence.",
      "missing_data": [
        "execution friction evidence"
      ],
      "confidence": 70
    },
    "valuation_friction": {
      "score": 30,
      "evidence_ids": [
        "bci_parent_label",
        "bci_parent_capital"
      ],
      "reasoning": "Valuation friction uses crowding, saturation, and good-news fatigue evidence.",
      "missing_data": [
        "valuation friction evidence"
      ],
      "confidence": 70
    },
    "transition_probability": {
      "score": 45,
      "evidence_ids": [
        "bci_parent_label",
        "bci_parent_capital"
      ],
      "reasoning": "Transition probability is capped by the completed Stage Gate classification.",
      "missing_data": [
        "next-stage trigger evidence"
      ],
      "confidence": 70
    },
    "narrative_delta_score": {
      "score": 55,
      "evidence_ids": [
        "bci_parent_label",
        "bci_parent_capital",
        "bci_branch_label_pricing",
        "bci_e001"
      ],
      "reasoning": "Narrative delta score requires memory/reactivation inputs; this value reflects structured evidence breadth only.",
      "missing_data": [
        "Narrative Memory comparison"
      ],
      "confidence": 73
    },
    "data_confidence": {
      "score": 70,
      "evidence_ids": [
        "bci_parent_label",
        "bci_parent_capital",
        "bci_branch_label_pricing",
        "bci_e001"
      ],
      "reasoning": "Data confidence reflects source breadth, authority, recency, balance, and layer coverage.",
      "missing_data": [],
      "confidence": 70
    }
  },
  "rule_version": "narrative-lifecycle-rules-v0.1"
}
